record_id,article_slug,article_title,module_kind,article_stage,canvas_dimension,description,content_value,audience_value,evidence_strength,repository_support,governance_need,ethical_risk,owner,status,review_date
orientation,5w1h-and-the-architecture-of-explanatory-completeness,5W1H and the Architecture of Explanatory Completeness,explanatory_structure,active,Orientation,"Defines the article purpose and reader promise: Who, what, when, where, why, and how as a durable explanatory structure.",0.84,0.84,0.74,0.7,0.58,0.22,editorial,active,2026-06-08
audience_need,5w1h-and-the-architecture-of-explanatory-completeness,5W1H and the Architecture of Explanatory Completeness,explanatory_structure,active,Audience Need,"Connects the article to reader jobs, pains, gains, questions, or decision needs.",0.82,0.88,0.72,0.68,0.62,0.26,editorial,active,2026-06-08
evidence_architecture,5w1h-and-the-architecture-of-explanatory-completeness,5W1H and the Architecture of Explanatory Completeness,explanatory_structure,active,Evidence Architecture,"Checks whether claims, examples, references, caveats, and interpretive limits support the article.",0.8,0.78,0.84,0.66,0.7,0.22,governance,review,2026-06-08
repository_integration,5w1h-and-the-architecture-of-explanatory-completeness,5W1H and the Architecture of Explanatory Completeness,explanatory_structure,active,Repository Integration,"Assesses whether code, data, outputs, documentation, and generated assets support reuse.",0.76,0.74,0.7,0.88,0.66,0.2,technical,active,2026-06-08
message_architecture,5w1h-and-the-architecture-of-explanatory-completeness,5W1H and the Architecture of Explanatory Completeness,explanatory_structure,active,Message Architecture,"Assesses title, opening, section sequence, examples, internal links, and next-step clarity.",0.86,0.82,0.74,0.64,0.6,0.24,editorial,active,2026-06-08
governance_review,5w1h-and-the-architecture-of-explanatory-completeness,5W1H and the Architecture of Explanatory Completeness,explanatory_structure,active,Governance Review,"Flags metadata freshness, link integrity, evidence review, repository status, and conceptual drift.",0.74,0.74,0.78,0.72,0.86,0.34,governance,review,2026-06-08
