category,description
Foundations,Definitions principles history and framework literacy
Knowledge Architecture,Pillar pages topic clusters taxonomies metadata internal links audits and editorial systems
Educational Research and Conceptual Frameworks,Learning scaffolds conceptual models evidence architecture and research communication
Classic Communication and Persuasive Sequence Frameworks,AIDA PAS BAB 5W1H response models storytelling and persuasion ethics
Audience Need Value Positioning and Message Architecture,Audience need positioning personas message houses and journey structures
Strategic and Environmental Analysis Frameworks,SWOT PESTLE competitive framing measurement and theory of change
Policy Governance Systems Explanation and Public Reasoning,Governance communication sustainability systems explanation and democratic understanding
Framework Composition Scaling and Editorial Governance,Composition scaling limits maintenance drift and AI-assisted design
