force,market_boundary,description,owner,status,review_date,intensity,evidence_strength,uncertainty,strategic_relevance,actionability,claim_strength,readiness_score,weighted_priority,evidence_gap,governance_priority,review_priority,governance_reasons
substitutes,structured knowledge platforms,AI summaries videos courses forums and internal systems can satisfy parts of the same audience need,editorial,review,2026-06-08,0.86,0.68,0.62,0.9,0.74,0.84,0.795,0.792,0.16,0.864,medium,high uncertainty; evidence gap; high governance priority; status marked review
rivalry,structured knowledge platforms,Search and publishing competition is high for strategic frameworks and educational explainers,strategy,review,2026-06-08,0.82,0.74,0.52,0.88,0.76,0.84,0.8,0.777,0.1,0.822,medium,high governance priority; status marked review
buyer power,structured knowledge platforms,Readers can compare alternatives and switch instantly which increases trust and value pressure,editorial,active,2026-06-08,0.84,0.76,0.48,0.88,0.82,0.82,0.825,0.79,0.06,0.817,medium,high governance priority
new entrants,structured knowledge platforms,Surface-level content entry is easy but governed systems with repositories are harder to replicate,strategy,review,2026-06-08,0.76,0.7,0.56,0.82,0.72,0.8,0.75,0.735,0.1,0.78,medium,high governance priority; status marked review
supplier power,structured knowledge platforms,Search CMS hosting analytics and AI-tool dependencies create supplier power and platform risk,technical,active,2026-06-08,0.72,0.7,0.5,0.78,0.66,0.76,0.715,0.697,0.06,0.724,standard,no immediate governance issue
competition,unclear,Vague example included to test weak specificity market-boundary evidence and governance review,strategy,revise,2026-06-08,0.58,0.3,0.7,0.52,0.42,0.78,0.455,0.506,0.48,0.722,high,unclear market boundary; weak evidence strength; weak strategic relevance; low actionability; high uncertainty; evidence gap; status marked revise
