"persona","segment","description","content_pathway","evidence_strength","specificity","content_fit","segment_alignment","governance_readiness","stereotype_risk","exclusion_risk","weak_evidence_risk","overgeneralization_risk","owner","status","review_date","readiness_score","weighted_readiness","risk_score","revision_pressure","review_priority"
"Beginner learner","Learning pathway","Reader who needs orientation definitions and examples","introductory_pathway",0.82,0.78,0.88,0.84,0.76,0.18,0.24,0.2,0.26,"editorial","active","2026-06-08",0.816,0.8188,0.26,0,"standard"
"Technical practitioner","Implementation pathway","User who needs reproducible workflows schemas and outputs","technical_pathway",0.78,0.82,0.86,0.8,0.8,0.16,0.22,0.24,0.28,"technical","active","2026-06-08",0.812,0.81,0.28,0,"standard"
"Strategic decision-maker","Strategy pathway","Leader evaluating value risk and resource implications","strategy_pathway",0.76,0.74,0.8,0.78,0.74,0.24,0.36,0.28,0.42,"strategy","active","2026-06-08",0.764,0.7648,0.42,0,"standard"
"Accessibility-focused reader","Accessibility pathway","Reader with access needs assistive technology constraints or format barriers","inclusive_design_pathway",0.72,0.7,0.78,0.74,0.84,0.28,0.58,0.34,0.44,"governance","review","2026-06-08",0.756,0.7512,0.58,0,"medium"
"Public stakeholder","Accountability pathway","Reader affected by policy platform or institutional decisions","public_reasoning_pathway",0.7,0.68,0.76,0.72,0.82,0.36,0.54,0.3,0.46,"governance","review","2026-06-08",0.736,0.7312,0.54,0,"medium"
"Generic user","Unclear segment","Weak persona included to test unsupported assumptions and overgeneralization","revision_pathway",0.34,0.38,0.42,0.4,0.36,0.52,0.48,0.72,0.66,"editorial","revise","2026-06-08",0.38,0.3772,0.72,0.3428,"high"
