element,model_layer,description,evidence_strength,assumption_importance,assumption_evidence,measurement_coverage,outcome_clarity,claim_strength,owner,status,review_date
Article maps,output,Structured article maps organize topic pathways and series navigation,0.78,0.72,0.66,0.80,0.82,0.82,editorial,active,2026-06-08
Improved reader navigation,outcome,Readers move through related framework articles with fewer dead ends,0.66,0.82,0.54,0.62,0.76,0.84,editorial,review,2026-06-08
Companion repositories,output,Canvas ready repositories provide reusable workflows schemas and generated outputs,0.74,0.70,0.58,0.78,0.72,0.82,platform,review,2026-06-08
Public reasoning impact,impact,Structured frameworks may support more careful public reasoning over time,0.42,0.90,0.36,0.34,0.52,0.78,strategy,revise,2026-06-08
Governance queue resolution,activity,Review and resolve high priority evidence and maintenance issues,0.76,0.68,0.70,0.86,0.80,0.80,governance,active,2026-06-08
Reader comprehension assumption,assumption,Readers understand framework language when examples definitions and pathway context are clear,0.58,0.86,0.48,0.56,0.68,0.82,editorial,review,2026-06-08
