article_order,title,status,cluster,slug,github_url,footer_navigation
1,What Are Content Frameworks?,published,Foundations,what-are-content-frameworks,yes,yes
2,Why Frameworks Matter in Research Education and Strategic Communication,published,Foundations,why-frameworks-matter-in-research-education-and-strategic-communication,yes,yes
3,What Makes a Powerful Content Framework?,published,Foundations,what-makes-a-powerful-content-framework,yes,yes
4,Framework Literacy and the Structure of Usable Knowledge,published,Foundations,framework-literacy-and-the-structure-of-usable-knowledge,yes,yes
5,Frameworks Templates and Models,published,Foundations,frameworks-templates-and-models,yes,yes
6,The History of Framework Thinking in Communication and Strategy,published,Foundations,the-history-of-framework-thinking-in-communication-and-strategy,yes,yes
7,Pillar Pages and Topic Clusters,published,Knowledge Architecture,pillar-pages-and-topic-clusters,yes,yes
8,Narrative Pathways and Knowledge Architecture,published,Knowledge Architecture,narrative-pathways-and-knowledge-architecture,yes,yes
9,Frameworks for Digital Knowledge Systems,published,Knowledge Architecture,frameworks-for-digital-knowledge-systems,yes,yes
