persona,segment,description,content_pathway,evidence_strength,specificity,content_fit,segment_alignment,governance_readiness,stereotype_risk,exclusion_risk,weak_evidence_risk,overgeneralization_risk,owner,status,review_date
Beginner learner,Learning pathway,Reader who needs orientation definitions and examples,introductory_pathway,0.82,0.78,0.88,0.84,0.76,0.18,0.24,0.20,0.26,editorial,active,2026-06-08
Technical practitioner,Implementation pathway,User who needs reproducible workflows schemas and outputs,technical_pathway,0.78,0.82,0.86,0.80,0.80,0.16,0.22,0.24,0.28,technical,active,2026-06-08
Public stakeholder,Accountability pathway,Reader affected by policy platform or institutional decisions,public_reasoning_pathway,0.70,0.68,0.76,0.72,0.82,0.36,0.54,0.30,0.46,governance,review,2026-06-08
Strategic decision-maker,Strategy pathway,Leader evaluating value risk and resource implications,strategy_pathway,0.76,0.74,0.80,0.78,0.74,0.24,0.36,0.28,0.42,strategy,active,2026-06-08
Accessibility-focused reader,Accessibility pathway,Reader with access needs assistive technology constraints or format barriers,inclusive_design_pathway,0.72,0.70,0.78,0.74,0.84,0.28,0.58,0.34,0.44,governance,review,2026-06-08
Generic user,Unclear segment,Weak persona included to test unsupported assumptions and overgeneralization,revision_pathway,0.34,0.38,0.42,0.40,0.36,0.52,0.48,0.72,0.66,editorial,revise,2026-06-08
