"slug","title","status","completed_fields","required_fields","completion_rate","metadata_readiness"
"what-are-content-frameworks","What Are Content Frameworks?","published",8,8,1,"ready"
"why-frameworks-matter-in-research-education-and-strategic-communication","Why Frameworks Matter in Research Education and Strategic Communication","published",8,8,1,"ready"
"what-makes-a-powerful-content-framework","What Makes a Powerful Content Framework?","published",8,8,1,"ready"
"framework-literacy-and-the-structure-of-usable-knowledge","Framework Literacy and the Structure of Usable Knowledge","published",8,8,1,"ready"
"frameworks-templates-and-models","Frameworks Templates and Models","published",8,8,1,"ready"
"the-history-of-framework-thinking-in-communication-and-strategy","The History of Framework Thinking in Communication and Strategy","planned",0,8,0,"needs metadata work"
