item,framework_type,description,clarity,fit,evidence_alignment,assumption_transparency,governance_readiness,oversimplification_risk,false_precision_risk,context_loss,audience_burden,value_opacity,owner,status,review_date
Decision scoring matrix,decision framework,Useful comparison tool but may imply false precision if criteria and weights are hidden,0.78,0.72,0.70,0.62,0.68,0.42,0.72,0.38,0.44,0.58,decision,review,2026-06-08
Systems explanation map,systems framework,Clarifies feedback and dependencies but needs agency responsibility and boundary notes,0.82,0.78,0.74,0.70,0.72,0.34,0.24,0.40,0.42,0.38,systems,active,2026-06-08
Article template,content framework,Improves consistency but may become formulaic when used without section judgment,0.80,0.76,0.68,0.66,0.70,0.52,0.26,0.46,0.36,0.34,editorial,active,2026-06-08
Legacy quadrant model,conceptual model,Older model has weak context notes high category compression and little evidence alignment,0.56,0.44,0.38,0.32,0.30,0.76,0.64,0.70,0.58,0.62,governance,revise,2026-06-08
Public reasoning framework,civic framework,Supports claims evidence values tradeoffs and accountability when participation limits are explicit,0.84,0.82,0.78,0.76,0.74,0.30,0.24,0.34,0.40,0.28,public,active,2026-06-08
Knowledge scaling template,knowledge framework,Reusable scaffold needs context preservation evidence status and retirement rules to avoid spreading stale assumptions,0.76,0.74,0.72,0.68,0.70,0.48,0.30,0.52,0.38,0.36,platform,active,2026-06-08
