element,model_layer,description,owner,status,review_date,evidence_strength,assumption_importance,assumption_evidence,measurement_coverage,outcome_clarity,claim_strength,assumption_risk,evidence_gap,pathway_quality,governance_priority,review_priority,governance_reasons,recommended_action
Public reasoning impact,impact,Structured frameworks may support more careful public reasoning over time,strategy,revise,2026-06-08,0.42,0.9,0.36,0.34,0.52,0.78,0.576,0.36,0.41,0.508,high,weak evidence strength; weak assumption evidence; weak measurement coverage; unclear outcome or impact claim; high assumption risk; evidence gap; unsupported impact claim; governance review needed; status marked revise,Revise this causal claim before reuse and strengthen evidence assumptions measurement coverage and outcome clarity.
Reader comprehension assumption,assumption,Readers understand framework language when examples definitions and pathway context are clear,editorial,review,2026-06-08,0.58,0.86,0.48,0.56,0.68,0.82,0.447,0.24,0.575,0.361,medium,weak evidence strength; weak assumption evidence; weak measurement coverage; high assumption risk; evidence gap; status marked review,Review assumptions evidence indicators stakeholders and failure points before using this pathway in communication.
Improved reader navigation,outcome,Readers move through related framework articles with fewer dead ends,editorial,review,2026-06-08,0.66,0.82,0.54,0.62,0.76,0.84,0.377,0.18,0.645,0.295,medium,weak assumption evidence; evidence gap; status marked review,Keep active and review during the next causal-framework governance cycle.
Companion repositories,output,Canvas ready repositories provide reusable workflows schemas and generated outputs,platform,review,2026-06-08,0.74,0.7,0.58,0.78,0.72,0.82,0.294,0.08,0.705,0.203,medium,weak assumption evidence; status marked review,Keep active and review during the next causal-framework governance cycle.
Article maps,output,Structured article maps organize topic pathways and series navigation,editorial,active,2026-06-08,0.78,0.72,0.66,0.8,0.82,0.82,0.245,0.04,0.765,0.158,standard,no immediate governance issue,Keep active and review during the next causal-framework governance cycle.
Governance queue resolution,activity,Review and resolve high priority evidence and maintenance issues,governance,active,2026-06-08,0.76,0.68,0.7,0.86,0.8,0.8,0.204,0.04,0.78,0.133,standard,no immediate governance issue,Keep active and review during the next causal-framework governance cycle.
