item,item_type,description,owner,status,review_date,conceptual_clarity,evidence_grounding,metadata_consistency,human_review_strength,bias_review,governance_maturity,platform_readiness,drift_control,unsupported_claim_risk,generic_structure_risk,output_validation,audience_impact,readiness_score,ai_framework_risk,governance_priority_score,governance_priority,governance_reasons,recommended_action
Unreviewed AI framework draft,draft,Generated framework draft with weak source grounding and no human review record,governance,revise,2026-06-09,0.5,0.34,0.48,0.22,0.3,0.28,0.4,0.34,0.78,0.72,0.36,0.68,0.357,0.697,0.692,high,weak conceptual clarity; weak evidence grounding; weak metadata consistency; weak human review strength; weak bias review; weak governance maturity; weak platform readiness; weak drift control; high unsupported-claim risk; high generic-structure risk; weak output validation; high AI framework risk; governance priority threshold reached; status marked revise,Do not publish this asset without revision. Strengthen source grounding human review bias review governance metadata drift control and output validation.
Article map candidate generation,article map,AI-assisted generation of candidate article map structures for editor review,editorial,active,2026-06-09,0.8,0.72,0.78,0.84,0.7,0.76,0.72,0.74,0.3,0.42,0.72,0.82,0.757,0.301,0.457,medium,high audience impact,Keep active and review during the next AI-assisted framework governance cycle.
Evidence architecture drafting,evidence system,AI-assisted claim-source mapping requiring direct human source verification,research,active,2026-06-09,0.76,0.82,0.74,0.86,0.72,0.8,0.7,0.76,0.34,0.36,0.7,0.78,0.77,0.295,0.441,medium,high audience impact,Keep active and review during the next AI-assisted framework governance cycle.
Metadata generation workflow,metadata,AI-assisted generation of SEO titles tags excerpts alt text and repository paths,editorial,active,2026-06-09,0.78,0.7,0.86,0.82,0.7,0.78,0.74,0.72,0.28,0.4,0.76,0.74,0.762,0.286,0.422,medium,no immediate AI-assisted framework governance issue,Keep active and review during the next AI-assisted framework governance cycle.
Canvas-ready repository scaffold,repository,AI-assisted scaffold with schemas tests outputs docs and governance queue,platform,review,2026-06-09,0.8,0.74,0.82,0.78,0.7,0.82,0.88,0.78,0.3,0.42,0.86,0.72,0.79,0.274,0.408,medium,status marked review,Review AI-assisted framework risk unsupported claims generic structure bias review output validation and audience impact during the next governance cycle.
AI drift detection workflow,governance workflow,AI-assisted comparison of definitions metadata examples and repository outputs across the series,governance,active,2026-06-09,0.76,0.72,0.8,0.82,0.74,0.84,0.82,0.88,0.26,0.34,0.8,0.76,0.797,0.249,0.402,medium,high audience impact,Keep active and review during the next AI-assisted framework governance cycle.
