item,item_type,description,owner,status,review_date,definition_consistency,boundary_clarity,evidence_currency,metadata_consistency,link_health,governance_maturity,reuse_pressure,stale_evidence_risk,dependency_complexity,platform_alignment,audience_impact,conceptual_integrity,drift_risk,repair_priority_score,repair_priority,governance_reasons,recommended_action
Legacy message framework,framework,Older message model reused across multiple pages without current scope notes,editorial,revise,2026-06-09,0.46,0.42,0.38,0.44,0.48,0.36,0.82,0.7,0.68,0.4,0.66,0.423,0.667,0.665,high,weak definition consistency; weak boundary clarity; weak evidence currency; weak metadata consistency; weak link health; weak governance maturity; high reuse pressure; high stale evidence risk; high dependency complexity; weak platform alignment; high drift risk; repair priority threshold reached; status marked revise,Repair this framework asset by restoring definition consistency boundary clarity evidence currency metadata link health governance maturity and platform alignment.
AI-assisted article template,template,Reusable assisted drafting template requiring controlled definitions evidence checks and article-specific review,platform,review,2026-06-09,0.72,0.7,0.68,0.76,0.72,0.72,0.78,0.36,0.6,0.7,0.76,0.717,0.449,0.543,medium,high reuse pressure; high dependency complexity; high audience impact; high drift risk; status marked review,Review drift risk reuse pressure stale evidence dependency complexity platform alignment and audience impact during the next governance cycle.
Content governance taxonomy,taxonomy,Tags categories and article types used for governance and discovery,governance,review,2026-06-09,0.7,0.68,0.66,0.72,0.74,0.7,0.58,0.32,0.5,0.68,0.78,0.7,0.394,0.51,medium,high audience impact; status marked review,Review drift risk reuse pressure stale evidence dependency complexity platform alignment and audience impact during the next governance cycle.
Framework definition,definition,Core definition of framework across the Content Frameworks series,editorial,active,2026-06-09,0.78,0.74,0.72,0.8,0.76,0.74,0.62,0.28,0.42,0.72,0.84,0.757,0.359,0.503,medium,high audience impact,Keep active and review during the next framework drift governance cycle.
Article map footer sequence,navigation,Series footer path and article map sequence across late-series governance pages,editorial,active,2026-06-09,0.76,0.78,0.7,0.8,0.88,0.76,0.56,0.22,0.46,0.74,0.8,0.78,0.332,0.472,medium,high audience impact,Keep active and review during the next framework drift governance cycle.
Canvas-ready repository pattern,repository,Reusable repository structure with schemas tests outputs and governance queues,platform,active,2026-06-09,0.8,0.78,0.74,0.84,0.76,0.78,0.64,0.24,0.52,0.86,0.72,0.783,0.343,0.456,medium,no immediate drift issue,Keep active and review during the next framework drift governance cycle.
