item,explanation_type,description,owner,status,review_date,boundary_clarity,actor_coverage,relationship_clarity,feedback_visibility,delay_visibility,stock_flow_clarity,stakeholder_visibility,evidence_strength,leverage_readiness,quality_score,systems_ambiguity,review_priority_score,review_priority,governance_reasons,recommended_action
Policy failure explanation,policy,Current draft overemphasizes individual compliance and lacks incentive and feedback explanation,policy,revise,2026-06-08,0.56,0.52,0.48,0.42,0.4,0.36,0.46,0.5,0.38,0.453,0.5,0.553,high,weak boundary clarity; weak actor coverage; weak relationship clarity; weak feedback visibility; weak delay visibility; weak stock-flow clarity; weak stakeholder visibility; weak evidence strength; weak leverage readiness; high systems ambiguity; review priority threshold reached; status marked revise,Revise this systems explanation before publication and strengthen boundaries actors relationships feedback delays evidence stakeholder visibility and leverage logic.
Technology adoption system,socio technical,Explains user behavior training support trust workflow disruption and feedback after launch,technology,review,2026-06-08,0.72,0.78,0.76,0.74,0.62,0.56,0.7,0.66,0.64,0.687,0.28,0.319,medium,weak stock-flow clarity; status marked review,Review boundary clarity relationship logic feedback visibility delay visibility evidence and stakeholder implications during the next governance cycle.
Sustainability boundary note,sustainability,Explains reporting boundary supplier effects rebound effects and system-wide impact limits,sustainability,active,2026-06-08,0.82,0.68,0.74,0.66,0.64,0.7,0.76,0.72,0.7,0.713,0.253,0.278,standard,no immediate governance issue,Keep active and review during the next systems explanation governance cycle.
Content architecture map,knowledge system,Maps articles metadata internal links evidence records and review queues,editorial,active,2026-06-08,0.84,0.72,0.8,0.72,0.66,0.76,0.62,0.74,0.78,0.738,0.215,0.268,standard,no immediate governance issue,Keep active and review during the next systems explanation governance cycle.
Public trust feedback loop,feedback,Explains how transparency responsiveness decisions and participation reinforce trust or distrust,governance,active,2026-06-08,0.78,0.76,0.82,0.86,0.7,0.58,0.74,0.7,0.68,0.736,0.216,0.263,standard,weak stock-flow clarity,Keep active and review during the next systems explanation governance cycle.
Infrastructure resilience system,infrastructure,Explains maintenance delays capacity constraints dependency risk and cascading failure pathways,infrastructure,active,2026-06-08,0.8,0.74,0.78,0.76,0.82,0.72,0.68,0.7,0.74,0.749,0.237,0.251,standard,no immediate governance issue,Keep active and review during the next systems explanation governance cycle.
