"item","communication_type","description","clarity","authority_coverage","evidence_strength","stakeholder_visibility","feedback_quality","channel_fit","cultural_alignment","governance_coverage","ambiguity","claim_strength","owner","status","review_date","quality_score","evidence_gap","trust_risk","review_priority_score","review_priority"
"Values statement","culture","States organizational values but needs stronger examples governance and behavioral evidence",0.72,0.56,0.48,0.6,0.5,0.7,0.62,0.46,0.58,0.82,"people","review","2026-06-08",0.58,0.34,0.519,0.4606,"high"
"Change announcement","change","Announces process change but lacks stakeholder impact and feedback pathway",0.66,0.62,0.58,0.42,0.36,0.68,0.54,0.5,0.66,0.78,"operations","revise","2026-06-08",0.545,0.2,0.557,0.4538,"high"
"Strategy update","leadership","Explains annual priorities owners review points and decision rationale",0.82,0.78,0.72,0.7,0.62,0.76,0.74,0.7,0.28,0.8,"leadership","active","2026-06-08",0.73,0.0800000000000001,0.303,0.2492,"standard"
"Onboarding knowledge map","internal","Connects new employees to roles systems decisions channels and durable knowledge assets",0.78,0.72,0.7,0.74,0.66,0.82,0.76,0.72,0.26,0.74,"knowledge","active","2026-06-08",0.7375,0.04,0.285,0.243,"standard"
"Public accountability page","external","Explains commitments evidence ownership review dates and correction routes",0.8,0.76,0.74,0.72,0.68,0.78,0.7,0.82,0.24,0.76,"communications","active","2026-06-08",0.75,0.02,0.247,0.2108,"standard"
"Decision record","institutional memory","Documents decision rationale evidence alternatives owner and review trigger",0.86,0.88,0.82,0.68,0.7,0.74,0.76,0.84,0.2,0.78,"governance","active","2026-06-08",0.785,0,0.219,0.1626,"standard"
