slug,title,status,completion_rate,missing_fields,metadata_readiness
what-are-content-frameworks,What Are Content Frameworks?,published,1.0,none,ready
why-frameworks-matter-in-research-education-and-strategic-communication,Why Frameworks Matter in Research Education and Strategic Communication,published,1.0,none,ready
what-makes-a-powerful-content-framework,What Makes a Powerful Content Framework?,published,1.0,none,ready
framework-literacy-and-the-structure-of-usable-knowledge,Framework Literacy and the Structure of Usable Knowledge,published,1.0,none,ready
frameworks-templates-and-models,Frameworks Templates and Models,planned,0.0,excerpt; tags; github_url; image_alt; references; last_reviewed; series_context; footer_navigation,needs metadata work
pillar-pages-and-topic-clusters,Pillar Pages and Topic Clusters,published,1.0,none,ready
